historico,natureza
"Deixei meu celular na mesa do café e, ao voltar, ele não estava mais lá; alguém o levou sem que eu percebesse.","furto a transeunte"
"Deixei minha carteira no balcão da loja e, quando retornei, ela havia sumido, indicando que alguém a pegou discretamente.","furto a transeunte"
"Durante uma pausa no parque, esqueci minha mochila em um banco e, ao voltar, notei sua ausência, como se tivesse sido levada sem que eu visse.","furto a transeunte"
"Enquanto conversava com amigos na praça, minha bolsa desapareceu, deixando-me surpreso com a rápida ação de um desconhecido.","furto a transeunte"
"Ao almoçar no refeitório, deixei meu relógio na mesa e, ao retornar, ele não estava mais lá, sugerindo que alguém o retirou sorrateiramente.","furto a transeunte"
"Na biblioteca, deixei meu notebook sobre uma mesa e, alguns minutos depois, percebi que ele havia sumido sem explicação.","furto a transeunte"
"Durante uma visita à feira, deixei meus pertences em uma banca e, quando me distrai com outras compras, percebi que faltava algo importante.","furto a transeunte"
"No ônibus, enquanto dormia, minha mochila foi levada; ao despertar, percebi sua ausência imediata.","furto a transeunte"
"Esperando na fila, coloquei minha bolsa ao lado e, quando voltei, ela já não estava mais, sugerindo a ação de um malandro.","furto a transeunte"
"No parque de diversões, deixei meu celular sobre um banco e, em meio à diversão, percebi que ele havia desaparecido misteriosamente.","furto a transeunte"
"Durante um café com amigos, esqueci meu celular na mesa e, ao retornar, ele havia sido levado por alguém que passava por ali.","furto a transeunte"
"Em uma tarde de compras, deixei minha carteira em cima do balcão e, ao me distrair, percebi que ela havia sumido de maneira inesperada.","furto a transeunte"
"No saguão do hotel, deixei meus pertences desprotegidos e, ao me voltar, notei que alguém os havia retirado sem minha atenção.","furto a transeunte"
"Enquanto esperava o ônibus, coloquei minha bolsa ao lado do banco e, após um breve momento, ela se foi, deixando um vazio inexplicável.","furto a transeunte"
"No parque, deixei minha mochila em um banco durante uma conversa e, ao voltar, ela não estava mais lá, como se tivesse sido levada silenciosamente.","furto a transeunte"
"Durante o intervalo na escola, deixei meu tablet na sala e, quando voltei, percebi que ele havia sido levado sem que eu notasse.","furto a transeunte"
"Em um encontro no shopping, esqueci meu celular em uma mesa de café e, ao retornar, ele não estava mais, sugerindo que alguém o retirou discretamente.","furto a transeunte"
"Enquanto caminhava pelo centro da cidade, percebi a ausência de minha carteira, que havia sido deixada momentaneamente em um local seguro.","furto a transeunte"
"No restaurante, deixei meu celular sobre a mesa e, ao retornar, descobri que alguém o havia levado discretamente.","furto a transeunte"
"Durante uma pausa para o lanche, deixei minha bolsa ao lado e, quando voltei, ela havia sido retirada sem aviso.","furto a transeunte"
"Na estação de trem, deixei minha mochila em um banco e, alguns instantes depois, percebi que ela havia sumido misteriosamente.","furto a transeunte"
"Durante uma visita a um museu, deixei meus pertences na entrada e, ao me distrair, notei que faltava algo importante.","furto a transeunte"
"No café, esqueci meu celular sobre a mesa; ao retornar, ele não estava mais, indicando uma ação rápida de um desconhecido.","furto a transeunte"
"Enquanto esperava um amigo, deixei minha carteira em um balcão e, em poucos minutos, ela foi retirada sem que eu visse.","furto a transeunte"
"Em uma tarde de lazer no parque, deixei minha bolsa em um banco e, ao voltar, ela havia sumido de forma inexplicável.","furto a transeunte"
"Durante uma reunião de trabalho em um café, esqueci meu celular na mesa e, quando retornei, percebi sua ausência.","furto a transeunte"
"Na biblioteca, enquanto estudava, deixei minha carteira em uma mesa; minutos depois, ela havia sido levada sem que eu percebesse.","furto a transeunte"
"Enquanto aguardava no ponto de ônibus, deixei minha mochila ao lado e, ao retornar, notei que ela havia sumido.","furto a transeunte"
"Durante uma pausa no shopping, deixei meus pertences em um banco e, em um instante, eles desapareceram sem que eu percebesse.","furto a transeunte"
"No café da manhã, deixei meu celular na mesa e, ao voltar, ele não estava mais lá, como se alguém o tivesse levado discretamente.","furto a transeunte"
"Enquanto almoçava em um restaurante, deixei minha bolsa ao lado e, em poucos momentos, ela havia sido retirada sem aviso.","furto a transeunte"
"Na sala de espera, deixei meus pertences sobre uma cadeira e, ao voltar, percebi que algo importante havia sumido.","furto a transeunte"
"Durante um passeio pelo parque, esqueci meu celular em um banco; ao retornar, ele havia desaparecido, como se alguém o tivesse levado.","furto a transeunte"
"No supermercado, coloquei minha carteira na cesta de compras e, ao me distrair, percebi que ela havia sido retirada sem que eu notasse.","furto a transeunte"
"Enquanto esperava um transporte, deixei minha mochila em um banco e, minutos depois, notei sua ausência inexplicável.","furto a transeunte"
"Durante uma reunião em um café, deixei meu celular na mesa e, ao retornar, ele havia sido levado sem que eu percebesse.","furto a transeunte"
"Enquanto caminhava pelo centro, deixei minha carteira em um ponto de apoio e, ao olhar novamente, ela havia sumido sem sinal.","furto a transeunte"
"Em uma visita a um parque, esqueci minha bolsa em um banco e, após alguns minutos, notei sua ausência repentina.","furto a transeunte"
"No café, enquanto lia um jornal, deixei meu celular sobre a mesa; ao voltar, percebi que alguém o havia levado discretamente.","furto a transeunte"
"Durante uma caminhada, deixei minha mochila em um local visível, mas quando voltei, ela não estava mais lá, indicando uma ação inesperada.","furto a transeunte"
"Ao jantar fora, coloquei minha carteira na mesa e, em um instante, ela desapareceu sem que eu conseguisse reagir.","furto a transeunte"
"Enquanto esperava o táxi, deixei meu celular em um banco; ao voltar, ele havia sido retirado sem aviso.","furto a transeunte"
"Durante um intervalo no trabalho, deixei minha bolsa em um local de fácil acesso e, minutos depois, ela havia sido levada sem que eu percebesse.","furto a transeunte"
"No parque, enquanto conversava com um amigo, deixei minha mochila ao lado e, em instantes, ela sumiu, como se alguém a tivesse retirado.","furto a transeunte"
"Em um café movimentado, esqueci meu celular sobre a mesa e, quando voltei, percebi que ele não estava mais lá, indicando que alguém o pegou.","furto a transeunte"
"Durante uma visita ao shopping, deixei minha carteira no balcão e, ao retornar, ela havia desaparecido de forma inesperada.","furto a transeunte"
"Enquanto esperava um compromisso, deixei minha bolsa em uma cadeira e, ao voltar, ela tinha sumido sem que eu notasse.","furto a transeunte"
"No centro cultural, deixei meu celular em uma mesa e, após alguns minutos, percebi sua ausência repentina, como se tivesse sido levado.","furto a transeunte"
"Durante uma pausa para o café, deixei minha mochila em um canto e, quando voltei, ela não estava mais, indicando a ação de alguém oportunista.","furto a transeunte"
"Em uma tarde de passeio, deixei minha carteira em um balcão e, ao me distrair, notei que ela havia sido retirada sem que eu percebesse.","furto a transeunte"
